{
  "network": "example-wallet",
  "out_trade_no": "MCH20240514123456789",
  "amount": "2700.00",
  "currency": "CNY",
  "resource_id": "urn:act:resource:example.com/digital-content-001",
  "pay_before": "2024-05-14T23:59:59Z",
  "seller_signature": "MEYCIQDtv8Qw3Xv6kZnP2mJaLcR5oN1yFgHsIbKdWxPqE7u4vAIhAOzR9sYmCnXpL3kQwBjTfN2aGdHe5VuMrXoIPcKs8Zt1",
  "seller_sign_type": "ES256",
  "seller_unique_id": "did:act:example.com/merchant-content-shop-001",
  "buyer_unique_id": "did:act:example.com/agent-alice-001",
  "method_extensions": {
    "account_reference": "acc-example-wallet-alice",
    "settlement_preference": "instant"
  }
}