{
  "network": "example-wallet",
  "out_trade_no": "ORD-20260419-001",
  "amount": "129.00",
  "currency": "CNY",
  "resource_id": "res-pkg-5g-129",
  "pay_before": "2026-04-19T08:30:00Z",
  "seller_signature": "MEUCIQDx...base64url",
  "seller_sign_type": "ES256",
  "seller_unique_id": "did:act:example.com/servicebot-01",
  "buyer_unique_id": "did:act:example.com/agent-alice-001"
}